{
  "$schema": "https://json-schema.org/draft/2020-12/schema",
  "title": "tare.tools Editorial Publication Decision",
  "type": "object",
  "additionalProperties": false,
  "required": [
    "decision_version",
    "decision_id",
    "document_id",
    "manifest_sha256",
    "decision",
    "pages_approved",
    "reviewer",
    "reviewed_at"
  ],
  "properties": {
    "decision_version": {"const": "1.0"},
    "decision_id": {"type": "string", "minLength": 1},
    "document_id": {"type": "string", "minLength": 1},
    "manifest_sha256": {"type": "string", "pattern": "^[0-9a-f]{64}$"},
    "decision": {"enum": ["accept", "revise", "reject", "park"]},
    "pages_approved": {"type": "boolean"},
    "reviewer": {
      "type": "object",
      "additionalProperties": false,
      "required": ["name", "role"],
      "properties": {
        "name": {"type": "string", "minLength": 1},
        "role": {"const": "editorial-reviewer"},
        "identity_ref": {"type": ["string", "null"]}
      }
    },
    "reviewed_at": {"type": "string", "minLength": 1},
    "notes": {"type": "string"}
  }
}
